{
  "schema": "influence-graph.v1",
  "graph_id": "00000000-0000-0000-0000-000000000000",
  "generated_at": "2000-01-01T00:00:00.000Z",
  "artifact": {
    "kind": "article",
    "input_mode": "fixture",
    "url": "https://fictional-daily.example/articles/synthetic-01-quoted-vs-authorial",
    "canonical_url": "https://fictional-daily.example/articles/synthetic-01-quoted-vs-authorial",
    "title": "Council approves downtown drainage upgrade",
    "byline": "Jordan Reyes",
    "publisher": {
      "name": null,
      "domain": "fictional-daily.example"
    },
    "published_at": "2026-09-15T14:00:00.000Z",
    "modified_at": null,
    "timestamp_precision": "time",
    "language": "en",
    "text_sha256": "af82cc08d58127c5629992bbc5273fda828e5a5a6c82c0c36d6a3318f3735644",
    "text_length_chars": 511,
    "paywall_detected": false,
    "authorization": {
      "user_asserted_public": true,
      "consent_at": "2026-09-18T00:00:00.000Z"
    }
  },
  "spans": [
    {
      "id": "span-1",
      "start": 0,
      "end": 42,
      "text": "Council approves downtown drainage upgrade",
      "paragraph_index": 0,
      "role": "headline",
      "attribution": {
        "speaker": null,
        "cue": null
      },
      "role_basis": "html_structure"
    },
    {
      "id": "span-2",
      "start": 43,
      "end": 185,
      "text": "The city council voted on Tuesday to approve a $4 million drainage upgrade for the downtown district after three seasons of repeated flooding.",
      "paragraph_index": 1,
      "role": "authorial",
      "attribution": {
        "speaker": null,
        "cue": null
      },
      "role_basis": "default"
    },
    {
      "id": "span-3",
      "start": 186,
      "end": 229,
      "text": "We will fix the flooding problem this year,",
      "paragraph_index": 2,
      "role": "quoted",
      "attribution": {
        "speaker": "the mayor",
        "cue": "said"
      },
      "role_basis": "quote_marks"
    },
    {
      "id": "span-4",
      "start": 230,
      "end": 270,
      "text": "the mayor said during Tuesday's meeting.",
      "paragraph_index": 2,
      "role": "authorial",
      "attribution": {
        "speaker": null,
        "cue": null
      },
      "role_basis": "default"
    },
    {
      "id": "span-5",
      "start": 271,
      "end": 390,
      "text": "The council said it would fix the flooding problem this year, directing staff to begin engineering work within 30 days.",
      "paragraph_index": 3,
      "role": "authorial",
      "attribution": {
        "speaker": null,
        "cue": null
      },
      "role_basis": "default"
    },
    {
      "id": "span-6",
      "start": 391,
      "end": 511,
      "text": "Sources close to the situation report growing frustration among residents who have filed dozens of complaints this year.",
      "paragraph_index": 4,
      "role": "uncertain",
      "attribution": {
        "speaker": null,
        "cue": null
      },
      "role_basis": "engine_disagreement"
    }
  ],
  "observations": [
    {
      "id": "obs-jev-1",
      "dimension": "language",
      "signal": "urgency",
      "strength": "observed",
      "localization": "span",
      "span_ids": [
        "span-3"
      ],
      "authorial_attribution": "quoted",
      "evidence": {
        "engine": "jev",
        "question_id": "influence_signal",
        "top_probability": 0.72,
        "answers_ref": "span-3"
      },
      "review_status": "auto",
      "ui_phrase": "Quoted language not attributed as authorial"
    },
    {
      "id": "obs-jev-2",
      "dimension": "language",
      "signal": "certainty_beyond_evidence",
      "strength": "candidate",
      "localization": "span",
      "span_ids": [
        "span-5"
      ],
      "authorial_attribution": "authorial",
      "evidence": {
        "engine": "jev",
        "question_id": "influence_signal",
        "top_probability": 0.75,
        "answers_ref": "span-5"
      },
      "review_status": "auto",
      "ui_phrase": "Observed influence signal"
    },
    {
      "id": "obs-jev-3",
      "dimension": "language",
      "signal": "vague_authority",
      "strength": "candidate",
      "localization": "span",
      "span_ids": [
        "span-6"
      ],
      "authorial_attribution": "unknown",
      "evidence": {
        "engine": "jev",
        "question_id": "influence_signal",
        "top_probability": 0.68,
        "answers_ref": "span-6"
      },
      "review_status": "needs_review",
      "ui_phrase": "Observed influence signal"
    }
  ],
  "claims": [
    {
      "id": "claim-1",
      "span_ids": [
        "span-2"
      ],
      "text": "The city council voted on Tuesday to approve a $4 million drainage upgrade for the downtown district after three seasons of repeated flooding.",
      "kind": "event",
      "attribution": "authorial",
      "support": "not_checked",
      "support_evidence": [],
      "review_status": "auto"
    },
    {
      "id": "claim-2",
      "span_ids": [
        "span-3"
      ],
      "text": "We will fix the flooding problem this year,",
      "kind": "prediction",
      "attribution": "quoted",
      "support": "not_checked",
      "support_evidence": [],
      "review_status": "auto"
    },
    {
      "id": "claim-3",
      "span_ids": [
        "span-5"
      ],
      "text": "The council said it would fix the flooding problem this year, directing staff to begin engineering work within 30 days.",
      "kind": "statistic",
      "attribution": "authorial",
      "support": "not_checked",
      "support_evidence": [],
      "review_status": "auto"
    }
  ],
  "coverage": {
    "status": "available",
    "provenance": "fixture",
    "story_origin": {
      "same_story_assessment": "same_story",
      "surfaced_article_published_at": "2026-09-15T14:00:00.000Z",
      "first_public_at": "2026-09-15T14:00:00.000Z",
      "original_url": "https://fictional-daily.example/articles/synthetic-01-quoted-vs-authorial",
      "original_source": "Fictional Daily",
      "canonical_coverage_url": null,
      "canonical_coverage_source": null,
      "canonical_coverage_published_at": null,
      "canonical_coverage_basis": null,
      "same_story_basis": "headline_wording",
      "new_development": false,
      "new_development_at": null,
      "confidence": "medium",
      "timestamp_evidence": [
        {
          "url_key": "https://fictional-daily.example/articles/synthetic-01-quoted-vs-authorial",
          "published_at": "2026-09-15T14:00:00.000Z"
        }
      ],
      "evidence_urls": [
        "https://fictional-daily.example/articles/synthetic-01-quoted-vs-authorial"
      ],
      "rationale": "Single-source synthetic fixture; no corroborating coverage."
    },
    "freshness_gate": {
      "computed_status": "stale",
      "basis_field": "first_public_at",
      "basis_value": "2026-09-15T14:00:00.000Z",
      "rationale": "Synthetic fixture published outside the freshness window."
    },
    "cluster": {
      "member_count": 1,
      "independent_sources_estimate": 1,
      "duplicate_or_syndicated_count": 0,
      "members": [
        {
          "url": "https://fictional-daily.example/articles/synthetic-01-quoted-vs-authorial",
          "url_key": "https://fictional-daily.example/articles/synthetic-01-quoted-vs-authorial",
          "source": "Fictional Daily",
          "published_at": "2026-09-15T14:00:00.000Z",
          "relation": "surfaced"
        }
      ]
    },
    "frames": [],
    "confidence": "medium"
  },
  "source_context": {
    "shown_separately": true,
    "publisher": {
      "name": null,
      "domain": "fictional-daily.example"
    },
    "canonical_domain": "fictional-daily.example",
    "metadata": {
      "has_byline": true,
      "has_published_time": true,
      "has_canonical": true,
      "syndication_markers": []
    },
    "third_party_ratings": [],
    "note": "Source context is metadata, not a manipulation judgment."
  },
  "abstentions": [
    {
      "id": "abst-failure-span-4",
      "scope": "span",
      "target": "span-4",
      "reason": "engine_failure",
      "message": "The typed classifier did not return a usable answer for this section, so no signal is shown for it."
    }
  ],
  "engine": {
    "pipeline_version": "media-lens-0.1.0",
    "preparation": {
      "version": "0.1.0",
      "extractor": "trafilatura",
      "extractor_version": "2.2.0",
      "extraction_status": "ok",
      "body_sha256": "d00cb633f1c7656bb5313b13ffd21990b867a2f7d0d21a93d2dffb4fde52fa7a",
      "content_type": "text/html",
      "fetch_status": "not_fetched",
      "fetched_at": null
    },
    "jev": {
      "mode": "fixture",
      "model_requested": "jev-1.13.0",
      "model_reported": "jev-1.13.0",
      "model_match": true,
      "question_set": "influence-questions.v1",
      "question_set_sha256": "69adf3fc7ec970cec12d16dba82d168f410b61d0e839d428ce151918bff49010",
      "calls": 6,
      "failures": 1,
      "elapsed_ms": 0
    },
    "newsjack": {
      "mode": "fixture",
      "version": null,
      "artifacts": []
    },
    "fusion": {
      "version": "0.1.0",
      "thresholds": {
        "observed_min_probability": 0.6,
        "candidate_min_probability": 0.45,
        "quoted_agreement_min": 0.7,
        "failure_rate_abstain": 0.2
      }
    },
    "timestamps": {
      "started_at": "2000-01-01T00:00:00.000Z",
      "completed_at": "2000-01-01T00:00:00.000Z"
    }
  },
  "privacy": {
    "external_processing": [],
    "clarity_isolation": "no_private_message_path",
    "full_text_persisted": false,
    "spans_included": "all",
    "retention": "none",
    "disclosure_shown": true
  }
}
