{
  "schema": "influence-graph.v1",
  "graph_id": "00000000-0000-0000-0000-000000000000",
  "generated_at": "2000-01-01T00:00:00.000Z",
  "artifact": {
    "kind": "article",
    "input_mode": "fixture",
    "url": "https://fictional-daily.example/articles/synthetic-03-no-timestamp",
    "canonical_url": "https://fictional-daily.example/articles/synthetic-03-no-timestamp",
    "title": "Neighborhood group organizes cleanup weekend",
    "byline": "Sam Okafor",
    "publisher": {
      "name": null,
      "domain": "fictional-daily.example"
    },
    "published_at": null,
    "modified_at": null,
    "timestamp_precision": "none",
    "language": "en",
    "text_sha256": "a26cd69ed85f9ba66ac29d8e2a810d83b317f6af43202a6c9539757953403c0e",
    "text_length_chars": 322,
    "paywall_detected": false,
    "authorization": {
      "user_asserted_public": true,
      "consent_at": "2026-09-18T00:00:00.000Z"
    }
  },
  "spans": [
    {
      "id": "span-1",
      "start": 0,
      "end": 44,
      "text": "Neighborhood group organizes cleanup weekend",
      "paragraph_index": 0,
      "role": "headline",
      "attribution": {
        "speaker": null,
        "cue": null
      },
      "role_basis": "html_structure"
    },
    {
      "id": "span-2",
      "start": 45,
      "end": 58,
      "text": "By Sam Okafor",
      "paragraph_index": 1,
      "role": "byline_meta",
      "attribution": {
        "speaker": null,
        "cue": null
      },
      "role_basis": "html_structure"
    },
    {
      "id": "span-3",
      "start": 59,
      "end": 208,
      "text": "A local neighborhood association is organizing a weekend cleanup along the riverfront trail, with volunteers asked to bring gloves and reusable bags.",
      "paragraph_index": 2,
      "role": "authorial",
      "attribution": {
        "speaker": null,
        "cue": null
      },
      "role_basis": "default"
    },
    {
      "id": "span-4",
      "start": 209,
      "end": 322,
      "text": "Organizers said the event has grown every year since it began, drawing dozens of participants from nearby blocks.",
      "paragraph_index": 3,
      "role": "authorial",
      "attribution": {
        "speaker": null,
        "cue": null
      },
      "role_basis": "default"
    }
  ],
  "observations": [],
  "claims": [],
  "coverage": {
    "status": "insufficient",
    "provenance": "none",
    "story_origin": null,
    "freshness_gate": null,
    "cluster": null,
    "frames": [],
    "confidence": "low"
  },
  "source_context": {
    "shown_separately": true,
    "publisher": {
      "name": null,
      "domain": "fictional-daily.example"
    },
    "canonical_domain": "fictional-daily.example",
    "metadata": {
      "has_byline": true,
      "has_published_time": false,
      "has_canonical": true,
      "syndication_markers": []
    },
    "third_party_ratings": [],
    "note": "Source context is metadata, not a manipulation judgment."
  },
  "abstentions": [
    {
      "id": "abst-coverage-provenance",
      "scope": "dimension",
      "target": "coverage",
      "reason": "no_provenance",
      "message": "No independent provenance data is available for this article, so coverage information is limited."
    },
    {
      "id": "abst-no-timestamp",
      "scope": "graph",
      "target": null,
      "reason": "no_timestamp",
      "message": "Publication time not verified: this article did not provide a machine-readable publish date."
    }
  ],
  "engine": {
    "pipeline_version": "media-lens-0.1.0",
    "preparation": {
      "version": "0.1.0",
      "extractor": "trafilatura",
      "extractor_version": "2.2.0",
      "extraction_status": "ok",
      "body_sha256": "e5fc8f19ab93c06bb024507b05b535d41c864fe69ce66b127024da5d9dbf4498",
      "content_type": "text/html",
      "fetch_status": "not_fetched",
      "fetched_at": null
    },
    "jev": {
      "mode": "fixture",
      "model_requested": "jev-1.13.0",
      "model_reported": "jev-1.13.0",
      "model_match": true,
      "question_set": "influence-questions.v1",
      "question_set_sha256": "69adf3fc7ec970cec12d16dba82d168f410b61d0e839d428ce151918bff49010",
      "calls": 3,
      "failures": 0,
      "elapsed_ms": 0
    },
    "newsjack": {
      "mode": "fixture",
      "version": null,
      "artifacts": []
    },
    "fusion": {
      "version": "0.1.0",
      "thresholds": {
        "observed_min_probability": 0.6,
        "candidate_min_probability": 0.45,
        "quoted_agreement_min": 0.7,
        "failure_rate_abstain": 0.2
      }
    },
    "timestamps": {
      "started_at": "2000-01-01T00:00:00.000Z",
      "completed_at": "2000-01-01T00:00:00.000Z"
    }
  },
  "privacy": {
    "external_processing": [],
    "clarity_isolation": "no_private_message_path",
    "full_text_persisted": false,
    "spans_included": "all",
    "retention": "none",
    "disclosure_shown": true
  }
}
